{
  "version": "1",
  "bountyId": "17",
  "attemptId": "2",
  "manifestDigest": "0x3333333333333333333333333333333333333333333333333333333333333333",
  "attemptDigest": "0x4444444444444444444444444444444444444444444444444444444444444444",
  "reportDigest": "0x5555555555555555555555555555555555555555555555555555555555555555",
  "imageDigest": "0x6666666666666666666666666666666666666666666666666666666666666666",
  "baseline": {
    "status": "expected_failure",
    "evidenceDigest": "0x7777777777777777777777777777777777777777777777777777777777777777"
  },
  "candidate": {
    "status": "passed",
    "evidenceDigest": "0x8888888888888888888888888888888888888888888888888888888888888888"
  },
  "regressionsPassed": true,
  "verdict": "approved",
  "signerOrganization": "reviewer-a",
  "signerAccount": "wallet:reviewer-a",
  "signatureScheme": "secp256k1",
  "signature": "0x9999999999999999999999999999999999999999999999999999999999999999999999999999999999999999999999999999999999999999999999999999999999",
  "expiresAtUnix": "1790000000"
}
